Datum;ID;Marke;Name;Preis;Gewicht
2026-06-08;1045887;REWE;Basilikum im Topf;189;1 Stück
2026-06-08;1033906;REWE;Cherry Romatomaten 250g;99;250g (1 kg = 3,96 €)
2026-06-08;1045889;REWE;Krause Petersilie im Topf;189;1 Stück
2026-06-08;8114415;REWE;REWE Bio Zuckermais vakuumiert 400g;249;400g (1 kg = 6,23 €)
2026-06-08;9013548;REWE;REWE Water+ Apfel Kiwi 0,5l;69;0,50l (1 l = 1,38 €)
2026-06-08;7629527;REWE;REWE Water+ Himbeer-Grapefruit 0,5l;69;0,50l (1 l = 1,38 €)
2026-06-08;1930502;REWE Bio;Bio Banane ca. 200g;40;1 Stück ca. 200 g (1 kg = 1,99 €)
2026-06-08;184647;REWE Bio;REWE Bio 6-Kräuter 50g;99;50g (1 kg = 19,80 €)
2026-06-08;201396;REWE Bio;REWE Bio Aceto Balsamico 500ml;249;500ml (1 l = 4,98 €)
2026-06-08;940075;REWE Bio;REWE Bio Agavendicksaft 250ml;179;250ml (1 l = 7,16 €)
2026-06-08;360671;REWE Bio;REWE Bio Ahornsirup 250ml;499;250ml (1 l = 19,96 €)
2026-06-08;8755778;REWE Bio;REWE Bio Akazienhonig 350g;699;350g (1 kg = 19,97 €)
2026-06-08;7290602;REWE Bio;REWE Bio Alpenkräuter Eistee 0,75l;119;0,75l (1 l = 1,59 €)
2026-06-08;8441023;REWE Bio;REWE Bio Apfel Birne Erdbeere 90g;69;90g (1 kg = 7,67 €)
2026-06-08;7956825;REWE Bio;REWE Bio Apfel-Aprikosenmark 360g;115;360g (1 kg = 3,19 €)
2026-06-08;208864;REWE Bio;REWE Bio Apfel-Bananenmark 360g;115;360g (1 kg = 3,19 €)
2026-06-08;8923180;REWE Bio;REWE Bio Apfel-Birnenmark 360g;115;360g (1 kg = 3,19 €)
2026-06-08;7956127;REWE Bio;REWE Bio Apfel-Brombeer-Himbeermark 360g;159;360g (1 kg = 4,42 €)
2026-06-08;8015081;REWE Bio;REWE Bio Apfel-Mango Saft 1l;229;1l
2026-06-08;208863;REWE Bio;REWE Bio Apfel-Mangomark 360g;115;360g (1 kg = 3,19 €)
2026-06-08;8467434;REWE Bio;REWE Bio Apfelchips 70g;249;70g (1 kg = 35,57 €)
2026-06-08;9897035;REWE Bio;REWE Bio Apfelessig naturtrüb 0,75l;175;750ml (1 l = 2,33 €)
2026-06-08;7955323;REWE Bio;REWE Bio Apfelmark 360g;115;360g (1 kg = 3,19 €)
2026-06-08;208859;REWE Bio;REWE Bio Apfelmark 700g;149;700g (1 kg = 2,13 €)
2026-06-08;7650152;REWE Bio;REWE Bio Apfelrotkohl 680g;149;650g (1 kg = 2,19 €)
2026-06-08;8387482;REWE Bio;REWE Bio Apfelsaft naturtrüb 1l;169;1l
2026-06-08;7292476;REWE Bio;REWE Bio Apfelschorle naturtrüb 0,75l;125;0,75l (1 l = 1,67 €)
2026-06-08;8861892;REWE Bio;REWE Bio Artischocken gegrillt 180g;349;180g (1 kg = 19,39 €)
2026-06-08;2228245;REWE Bio;REWE Bio Asia Sauce süß-sauer 325ml;199;325ml (1 l = 6,12 €)
2026-06-08;2228247;REWE Bio;REWE Bio Asia-Sauce Thai-Curry 325ml;199;325ml (1 l = 6,12 €)
2026-06-08;2333554;REWE Bio;REWE Bio Avocado 1 Stück;199;1 Stück
2026-06-08;8756269;REWE Bio;REWE Bio Avocado Gewürzzubereitung 30g;269;30g (1 kg = 89,67 €)
2026-06-08;9881633;REWE Bio;REWE Bio Ayran 250ml;65;250ml (1 l = 2,60 €)
2026-06-08;8231031;REWE Bio;REWE Bio Baby Mais Hirse Flips 30g;79;30g (1 kg = 26,33 €)
2026-06-08;7916631;REWE Bio;REWE Bio Backhefe 3x7g;159;21g (1 kg = 75,71 €)
2026-06-08;7606570;REWE Bio;REWE Bio Bacon 100g;199;100g (1 kg = 19,90 €)
2026-06-08;9829850;REWE Bio;REWE Bio Bacon-Würfel Schwein 100g;199;100g (1 kg = 19,90 €)
2026-06-08;7584607;REWE Bio;REWE Bio Baguette Salami 80g;199;80g (1 kg = 24,88 €)
2026-06-08;8745443;REWE Bio;REWE Bio Baked Beans 400g;179;400g (1 kg = 4,48 €)
2026-06-08;3018245;REWE Bio;REWE Bio Bananenchips gesüßt 300g;259;300g (1 kg = 8,63 €)
2026-06-08;8173488;REWE Bio;REWE Bio Bandnudeln vegan 500g;159;500g (1 kg = 3,18 €)
2026-06-08;1045916;REWE Bio;REWE Bio Basilikum im Topf;199;NaN
2026-06-08;7296461;REWE Bio;REWE Bio Basis Porridge 500g;279;500g (1 kg = 5,58 €)
2026-06-08;7639373;REWE Bio;REWE Bio Basmati Expressreis 250g;179;250g (1 kg = 7,16 €)
2026-06-08;9480202;REWE Bio;REWE Bio Bauernbrötchen 480g;249;480g
2026-06-08;8277708;REWE Bio;REWE Bio Beeren Crunchy 500g;279;500g (1 kg = 5,58 €)
2026-06-08;8341949;REWE Bio;REWE Bio Beerenmix tiefgefroren 300g;379;300g (1 kg = 12,63 €)
2026-06-08;974656;REWE Bio;REWE Bio Beerenmüsli 500g;279;500g (1 kg = 5,58 €)
2026-06-08;7170158;REWE Bio;REWE Bio Beluga Linsen 500g;259;500g (1 kg = 5,18 €)
2026-06-08;505322;REWE Bio;REWE Bio Bergkäse 150g;259;150g (1 kg = 17,27 €)
2026-06-08;7317879;REWE Bio;REWE Bio Bierschinken 80g;199;80g (1 kg = 24,88 €)
2026-06-08;8288250;REWE Bio;REWE Bio Bircher-Müsli 500g;299;500g (1 kg = 5,98 €)
2026-06-08;1093362;REWE Bio;REWE Bio Birnen 500g;259;500g (1 kg = 5,18 €)
2026-06-08;9897192;REWE Bio;REWE Bio Birnensaft naturtrüb 1l;229;1l
2026-06-08;871215;REWE Bio;REWE Bio Blattspinat 600g;249;600g (1 kg = 4,15 €)
2026-06-08;7226966;REWE Bio;REWE Bio Blütenhonig 350g;255;350g (1 kg = 7,29 €)
2026-06-08;7840879;REWE Bio;REWE Bio Bonbons Orange & Kurkuma 75g;119;75g (1 kg = 15,87 €)
2026-06-08;8046482;REWE Bio;REWE Bio Bourbon Vanille Zucker 8g;299;4x8g (1 kg = 93,44 €)
2026-06-08;9597508;REWE Bio;REWE Bio Bourbon Vanille gemahlen 5g;299;5g
2026-06-08;9511626;REWE Bio;REWE Bio Bourbon-Vanille Schote 7g;299;7g
2026-06-08;8885824;REWE Bio;REWE Bio Brat- und Grilltaler Natur 240g;299;240g (1 kg = 12,46 €)
2026-06-08;1287110;REWE Bio;REWE Bio Bratwurst grob 300g;679;300g (1 kg = 22,63 €)
2026-06-08;8985750;REWE Bio;REWE Bio Bratöl 750ml;275;750ml (1 l = 3,67 €)
2026-06-08;7602279;REWE Bio;REWE Bio Braune Linsen 265g;149;265g (1 kg = 5,62 €)
2026-06-08;9057280;REWE Bio;REWE Bio Braunes Mandelmus vegan 250g;599;250g (1 kg = 23,96 €)
2026-06-08;8611706;REWE Bio;REWE Bio Brechbohnen 185g;109;185g (1 kg = 5,89 €)
2026-06-08;742294;REWE Bio;REWE Bio Brechbohnen 450g;189;450g (1 kg = 4,20 €)
2026-06-08;2245231;REWE Bio;REWE Bio Broccoli 400g;269;400g (1 kg = 6,73 €)
2026-06-08;273709;REWE Bio;REWE Bio Broccoli tiefgefroren 300g;189;300g (1 kg = 6,30 €)
2026-06-08;9517773;REWE Bio;REWE Bio Brombeeren gefroren 300g;379;300g (1 kg = 12,63 €)
2026-06-08;8042389;REWE Bio;REWE Bio Brot mit Sonnenblumenkernen 500g;239;500g (1 kg = 4,78 €)
2026-06-08;7171655;REWE Bio;REWE Bio Bulgur 500g;139;500g (1 kg = 2,78 €)
2026-06-08;7794507;REWE Bio;REWE Bio Bunter Pfeffer ganz 60g;299;60g (1 kg = 49,83 €)
2026-06-08;1136740;REWE Bio;REWE Bio Buttergemüse 300g;169;300g (1 kg = 5,63 €)
2026-06-08;9873900;REWE Bio;REWE Bio Butterkäse Scheiben 200g;199;200g (1 kg = 9,95 €)
2026-06-08;901435;REWE Bio;REWE Bio Caffè Crema 219g, 30 Pads;389;210g (1 kg = 18,52 €)
2026-06-08;2557918;REWE Bio;REWE Bio Caffè Crema ganze Bohne 1kg;1445;1000g
2026-06-08;1323529;REWE Bio;REWE Bio Caffè Latte 250ml;99;250ml (1 l = 3,96 €)
2026-06-08;578901;REWE Bio;REWE Bio Camembert 150g;199;150g (1 kg = 13,27 €)
2026-06-08;9471501;REWE Bio;REWE Bio Cappelletti Grillgemüse Ricotta 250g;219;250g (1 kg = 8,76 €)
2026-06-08;278145;REWE Bio;REWE Bio Cappelletti Spinat-Ricotta 250g;219;250g (1 kg = 8,76 €)
2026-06-08;3212382;REWE Bio;REWE Bio Cashew Cranberry Mix 250g;399;250g (1 kg = 15,96 €)
2026-06-08;39464;REWE Bio;REWE Bio Cashewkerne 250g;399;250g (1 kg = 15,96 €)
2026-06-08;8764037;REWE Bio;REWE Bio Cashewkerne Salz & Pfeffer geröstet 125g;269;125g (1 kg = 21,52 €)
2026-06-08;1947712;REWE Bio;REWE Bio Cassis Sirup 0,5l;329;0,50l (1 l = 6,58 €)
2026-06-08;8312738;REWE Bio;REWE Bio Champignons braun 250g;249;250g (1 kg = 9,96 €)
2026-06-08;8613784;REWE Bio;REWE Bio Champignons in Scheiben 170g;179;170g (1 kg = 10,53 €)
2026-06-08;9851675;REWE Bio;REWE Bio Chili con Carne 400g;195;400g (1 kg = 4,88 €)
2026-06-08;8551498;REWE Bio;REWE Bio Cocktail-Würstchen 190g;349;190g (1 kg = 18,37 €)
2026-06-08;8084861;REWE Bio;REWE Bio Condimento Bianco 500ml;249;500ml (1 l = 4,98 €)
2026-06-08;9078265;REWE Bio;REWE Bio Cornflakes ungesüsst 375g;149;375g (1 kg = 3,97 €)
2026-06-08;1202493;REWE Bio;REWE Bio Cornichons 190g;259;190g (1 kg = 13,63 €)
2026-06-08;294337;REWE Bio;REWE Bio Couscous 500g;129;500g (1 kg = 2,58 €)
2026-06-08;946608;REWE Bio;REWE Bio Creamy Erdnussbutter 250g;199;250g (1 kg = 7,96 €)
2026-06-08;8098823;REWE Bio;REWE Bio Crema mit Aceto Balsamico 250ml;299;250ml (1 l = 11,96 €)
2026-06-08;9086786;REWE Bio;REWE Bio Curry Sauce Indische Art vegan 325ml;199;325ml (1 l = 6,12 €)
2026-06-08;577458;REWE Bio;REWE Bio Currypulver 50g;229;50g (1 kg = 45,80 €)
2026-06-08;7678937;REWE Bio;REWE Bio Das Pure 300g;175;300g (1 kg = 5,83 €)
2026-06-08;8664302;REWE Bio;REWE Bio Dattel-Erdnuss Riegel 3x30g;179;3x30g (1 kg = 19,89 €)
2026-06-08;9036587;REWE Bio;REWE Bio Deutscher Blütenhonig 250g;399;250g (1 kg = 15,96 €)
2026-06-08;1438494;REWE Bio;REWE Bio Dill 50g;99;50g (1 kg = 19,80 €)
2026-06-08;8060098;REWE Bio;REWE Bio Dinkel Doppelkeks 330g;205;330g (1 kg = 6,21 €)
2026-06-08;9026176;REWE Bio;REWE Bio Dinkel Flakes 400g;249;400g (1 kg = 6,23 €)
2026-06-08;7249413;REWE Bio;REWE Bio Dinkel Frischeiwaffel 165g;179;165g (1 kg = 10,85 €)
2026-06-08;3100603;REWE Bio;REWE Bio Dinkel-Vollkornmehl 1kg;129;1000g
2026-06-08;7888159;REWE Bio;REWE Bio Dinkelbrot 400g;269;400g (1 kg = 6,73 €)
2026-06-08;9026254;REWE Bio;REWE Bio Dinkelmehl 1050 1kg;129;1000g
2026-06-08;2304849;REWE Bio;REWE Bio Dinkelmehl Type 630 1kg;129;1000g
2026-06-08;9885808;REWE Bio;REWE Bio Edamame 500g;269;500g (1 kg = 5,38 €)
2026-06-08;8363050;REWE Bio;REWE Bio Edamame ohne Schote 300g;369;300g (1 kg = 12,30 €)
2026-06-08;8007642;REWE Bio;REWE Bio Edel-Bitter-Schokolade 70% 100g;185;100g (1 kg = 18,50 €)
2026-06-08;3009709;REWE Bio;REWE Bio Edel-Bitter-Schokolade 85% 100g;199;100g (1 kg = 19,90 €)
2026-06-08;1006852;REWE Bio;REWE Bio Edelvollmilch-Schokolade 100g;185;100g (1 kg = 18,50 €)
2026-06-08;7078288;REWE Bio;REWE Bio Eier Spitz und Bube 6 Stück;329;6 Stück
2026-06-08;7063885;REWE Bio;REWE Bio Eisbergsalat 1 Stück;199;1 Stück
2026-06-08;7788256;REWE Bio;REWE Bio Eiweißbrot mit Erbsen 250g;249;250g (1 kg = 9,96 €)
2026-06-08;200348;REWE Bio;REWE Bio Emmentaler 150g;259;150g (1 kg = 17,27 €)
2026-06-08;577900;REWE Bio;REWE Bio Emmentaler gerieben 150g;159;150g (1 kg = 10,60 €)
2026-06-08;9583865;REWE Bio;REWE Bio Erbeere Konfitüre Extra 330g;169;330g (1 kg = 5,12 €)
2026-06-08;9556631;REWE Bio;REWE Bio Erbsen & Möhren 330g;149;215g (1 kg = 6,93 €)
2026-06-08;7891436;REWE Bio;REWE Bio Erbsen 230g;149;230g (1 kg = 6,48 €)
2026-06-08;9847589;REWE Bio;REWE Bio Erbseneintopf vegan 800g;289;800g (1 kg = 3,61 €)
2026-06-08;7713845;REWE Bio;REWE Bio Erdnussbutter Crunchy vegan 250g;199;250g (1 kg = 7,96 €)
2026-06-08;2903350;REWE Bio;REWE Bio Erdnüsse 250g;199;250g (1 kg = 7,96 €)
2026-06-08;8753645;REWE Bio;REWE Bio Erdnüsse gesalzen 150g;169;150g (1 kg = 11,27 €)
2026-06-08;8764704;REWE Bio;REWE Bio Espresso ganze Bohnen 1000g;1445;1000g
2026-06-08;7639176;REWE Bio;REWE Bio Express Getreide & Linsen 250g;179;250g (1 kg = 7,16 €)
2026-06-08;8998378;REWE Bio;REWE Bio Expressreis Vollkorn & Wildreis 250g;179;250g (1 kg = 7,16 €)
2026-06-08;9504395;REWE Bio;REWE Bio Farmerschinken 100g;299;100g (1 kg = 29,90 €)
2026-06-08;8960794;REWE Bio;REWE Bio Feta 200g;269;200g (1 kg = 13,45 €)
2026-06-08;197877;REWE Bio;REWE Bio Fettarme H-Milch 1,5% 1l;115;1l
2026-06-08;8061857;REWE Bio;REWE Bio Finn Toasties 260g;95;260g (1 kg = 3,65 €)
2026-06-08;9093769;REWE Bio;REWE Bio Flapjack Schoko Haferriegel vegan 60g;149;60g (1 kg = 24,83 €)
2026-06-08;9579984;REWE Bio;REWE Bio Fleischsalat mit Gurke 150g;189;150g (1 kg = 12,60 €)
2026-06-08;8955318;REWE Bio;REWE Bio Fleischwurst 200g;299;200g (1 kg = 14,95 €)
2026-06-08;3064105;REWE Bio;REWE Bio Frische Backhefe 42g;59;42g (1 kg = 14,05 €)
2026-06-08;1912315;REWE Bio;REWE Bio Frische Buttermilch 500g;89;500g (1 kg = 1,78 €)
2026-06-08;197862;REWE Bio;REWE Bio Frische Weidemilch 1,5% 1l;125;1l
2026-06-08;197872;REWE Bio;REWE Bio Frische Weidemilch 3,8% 1l;135;1l
2026-06-08;200397;REWE Bio;REWE Bio Frischkäse Doppelrahmstufe 175g;139;175g (1 kg = 7,94 €)
2026-06-08;8674448;REWE Bio;REWE Bio Frischkäse mit Kräutern 175g;139;175g (1 kg = 7,94 €)
2026-06-08;7293919;REWE Bio;REWE Bio Frucht Ringe 300g;229;300g (1 kg = 7,63 €)
2026-06-08;940052;REWE Bio;REWE Bio Fruchtaufstrich Aprikose 250g;225;250g (1 kg = 9 €)
2026-06-08;940043;REWE Bio;REWE Bio Fruchtaufstrich Erdbeere 250g;225;250g (1 kg = 9 €)
2026-06-08;2195547;REWE Bio;REWE Bio Fruchtaufstrich Himbeere 250g;225;250g (1 kg = 9 €)
2026-06-08;9011626;REWE Bio;REWE Bio Fruchtpüree Apfel Banane 400g;199;400g (1 kg = 4,98 €)
2026-06-08;9015066;REWE Bio;REWE Bio Fruchtpüree Apfel Pfirsich Mango 400g;219;400g (1 kg = 5,48 €)
2026-06-08;8170636;REWE Bio;REWE Bio Fruchtschnitte Apfel vegan 150g;289;5x30g (1 kg = 19,27 €)
2026-06-08;8936906;REWE Bio;REWE Bio Fruchtschnitte Banane Maracuja 150g;289;150g (1 kg = 19,27 €)
2026-06-08;9050225;REWE Bio;REWE Bio Früchtetee 40g 20 Beutel;95;40g (1 kg = 23,75 €)
2026-06-08;9503240;REWE Bio;REWE Bio Früchtetee Französischer Cassis 36g;179;36g (1 kg = 49,72 €)
2026-06-08;9533144;REWE Bio;REWE Bio Früchtetee Spanische Orange 18 Beutel;179;36g (1 kg = 49,72 €)
2026-06-08;7547590;REWE Bio;REWE Bio Frühstücksdirektsaft 1l;259;1l
2026-06-08;9899469;REWE Bio;REWE Bio Fusilli Rote Linse 250g;159;250g (1 kg = 6,36 €)
2026-06-08;7050770;REWE Bio;REWE Bio Fusilli Vollkorn Dinkel 500g;155;500g (1 kg = 3,10 €)
2026-06-08;9891780;REWE Bio;REWE Bio Fusilli aus Vollkornreis glutenfrei 250g;159;250g (1 kg = 6,36 €)
2026-06-08;7620459;REWE Bio;REWE Bio Ganze Tomaten geschält 240g;99;240g (1 kg = 4,13 €)
2026-06-08;8822460;REWE Bio;REWE Bio Garam Masala gemahlen 30g;259;30g (1 kg = 86,33 €)
2026-06-08;8659989;REWE Bio;REWE Bio Garnelen mediterrane Art 250g;779;250g (1 kg = 31,16 €)
2026-06-08;2439530;REWE Bio;REWE Bio Gartenkresse 1 Stück;59;1 Stück
2026-06-08;9504634;REWE Bio;REWE Bio Geflügel Rostbratwurst 200g;429;200g (1 kg = 21,45 €)
2026-06-08;7829813;REWE Bio;REWE Bio Geflügel Wiener 200g;399;200g (1 kg = 19,95 €)
2026-06-08;7314211;REWE Bio;REWE Bio Geflügel-Salami 80g;219;80g (1 kg = 27,38 €)
2026-06-08;7634526;REWE Bio;REWE Bio Geflügelfond 400g;219;400g (1 kg = 5,48 €)
2026-06-08;1267801;REWE Bio;REWE Bio Geflügelfrikadellen 200g;299;200g (1 kg = 14,95 €)
2026-06-08;1267875;REWE Bio;REWE Bio Geflügelhackbällchen 300g;499;300g (1 kg = 16,63 €)
2026-06-08;9115352;REWE Bio;REWE Bio Geflügelschnitte Cordon Bleu Art 300g;799;300g
2026-06-08;9015821;REWE Bio;REWE Bio Gegrillte Artischocken 125g;269;125g (1 kg = 21,52 €)
2026-06-08;8360458;REWE Bio;REWE Bio Gemüsebrühe 140g;139;140g (1 kg = 9,93 €)
2026-06-08;7032815;REWE Bio;REWE Bio Gemüsebrühe 290g;289;290g (1 kg = 9,97 €)
2026-06-08;8589069;REWE Bio;REWE Bio Gemüsefond 400ml;219;400ml (1 l = 5,48 €)
2026-06-08;9104609;REWE Bio;REWE Bio Gemüsepfanne nach französischer Art 600g;249;600g (1 kg = 4,15 €)
2026-06-08;9102082;REWE Bio;REWE Bio Gemüsepfanne nach mediterrraner Art 600g;249;600g (1 kg = 4,15 €)
2026-06-08;7633625;REWE Bio;REWE Bio Getrocknete Tomaten 125g;269;125g
2026-06-08;351098;REWE Bio;REWE Bio Gewürzgurken 360g;235;360g (1 kg = 6,53 €)
2026-06-08;9535048;REWE Bio;REWE Bio Gewürztee Indischer Chai 18 Beutel;179;36g (1 kg = 49,72 €)
2026-06-08;1027200;REWE Bio;REWE Bio Gnocchi 300g;219;300g (1 kg = 7,30 €)
2026-06-08;7700464;REWE Bio;REWE Bio Goldhirse 800g;169;800g (1 kg = 2,11 €)
2026-06-08;7715074;REWE Bio;REWE Bio Gouda Holland jung 250g;289;250g (1 kg = 11,56 €)
2026-06-08;7743850;REWE Bio;REWE Bio Gouda Mittelalt pikant 150g;279;150g (1 kg = 18,60 €)
2026-06-08;9894556;REWE Bio;REWE Bio Gouda Scheiben 200g;199;200g (1 kg = 9,95 €)
2026-06-08;7814263;REWE Bio;REWE Bio Gouda gerieben 150g;159;150g (1 kg = 10,60 €)
2026-06-08;4623991;REWE Bio;REWE Bio Grapefruit 1 Stück;135;1 Stück
2026-06-08;1346550;REWE Bio;REWE Bio Grillfackeln ca. 300g;807;1 Stück ca. 300 g (1 kg = 26,90 €)
2026-06-08;281097;REWE Bio;REWE Bio Grüne Erbsen 500g;189;500g (1 kg = 3,78 €)
2026-06-08;9849627;REWE Bio;REWE Bio Grüne Oliven ohne Stein 180g;299;180g (1 kg = 16,61 €)
2026-06-08;8109437;REWE Bio;REWE Bio Grüner Tee 30g;95;30g (1 kg = 31,67 €)
2026-06-08;9849274;REWE Bio;REWE Bio Gulaschsuppe 400g;259;400g (1 kg = 6,48 €)
2026-06-08;7359497;REWE Bio;REWE Bio Gurke 1 Stück;179;1 Stück
2026-06-08;197889;REWE Bio;REWE Bio H-Vollmilch 3,8% 1l;125;1l
2026-06-08;1287065;REWE Bio;REWE Bio Hackfleisch gemischt zum Braten 400g;849;400g (1 kg = 21,23 €)
2026-06-08;8514209;REWE Bio;REWE Bio Hafer-Crunchy 500g;259;500g (1 kg = 5,18 €)
2026-06-08;7956836;REWE Bio;REWE Bio Hafer-Schoko Riegel 3x35g;189;3x35g (1 kg = 18 €)
2026-06-08;7205443;REWE Bio;REWE Bio Hafercookie 300g;149;300g (1 kg = 4,97 €)
2026-06-08;7206215;REWE Bio;REWE Bio Hafercookie Vollmilch 300g;329;300g (1 kg = 10,97 €)
2026-06-08;8877863;REWE Bio;REWE Bio Hafercookies Zartbitter vegan 300g;329;300g (1 kg = 10,97 €)
2026-06-08;7732292;REWE Bio;REWE Bio Haferflocken kernig 500g;95;500g (1 kg = 1,90 €)
2026-06-08;8933690;REWE Bio;REWE Bio Haferkleie 500g;189;500g (1 kg = 3,78 €)
2026-06-08;7648254;REWE Bio;REWE Bio Haferpops 375g;245;375g (1 kg = 6,53 €)
2026-06-08;1267687;REWE Bio;REWE Bio Halbes Hähnchen 850g;1182;1 Stück ca. 850 g (1 kg = 13,90 €)
2026-06-08;9507625;REWE Bio;REWE Bio Halloumi Grillkäse aus Zypern 200g;389;200g (1 kg = 19,45 €)
2026-06-08;7295583;REWE Bio;REWE Bio Hamburger vom Rind 250g;699;250g (1 kg = 27,96 €)
2026-06-08;741455;REWE Bio;REWE Bio Himbeeren tiefgefroren 300g;379;300g (1 kg = 12,63 €)
2026-06-08;7827840;REWE Bio;REWE Bio Hirtenkäse 45% 200g;219;200g (1 kg = 10,95 €)
2026-06-08;2188055;REWE Bio;REWE Bio Hokkaido-Kürbis 450g;189;450g (1 kg = 4,20 €)
2026-06-08;1947997;REWE Bio;REWE Bio Holunderblütensirup 0,5l;299;0,50l (1 l = 5,98 €)
2026-06-08;7272521;REWE Bio;REWE Bio Honig-Dinkel gepufft 200g;179;200g (1 kg = 8,95 €)
2026-06-08;7341987;REWE Bio;REWE Bio Honigmelone;449;1 Stück ca. 1000 g (1 kg = 4,49 €)
2026-06-08;7033383;REWE Bio;REWE Bio Hähnchen Brustfilet Joghurt Knoblauch 320g;1117;1 Stück ca. 320 g (1 kg = 34,90 €)
2026-06-08;7034166;REWE Bio;REWE Bio Hähnchen Brustfilet Joghurt Paprika 320g;1117;1 Stück ca. 320 g (1 kg = 34,90 €)
2026-06-08;1268085;REWE Bio;REWE Bio Hähnchen Innenfilet Western Art;628;1 Stück ca. 180 g (1 kg = 34,90 €)
2026-06-08;1267674;REWE Bio;REWE Bio Hähnchen ca. 1,3kg;1677;1 Stück ca. 1300 g (1 kg = 12,90 €)
2026-06-08;1268079;REWE Bio;REWE Bio Hähnchen-Flügel 400g;396;1 Stück ca. 400 g (1 kg = 9,90 €)
2026-06-08;1267719;REWE Bio;REWE Bio Hähnchenbrustfilet ca. 320g;1117;1 Stück ca. 320 g (1 kg = 34,90 €)
2026-06-08;9507782;REWE Bio;REWE Bio Hähnchenbrustfilet gepökelt gebacken 100g;379;100g (1 kg = 37,90 €)
2026-06-08;1267989;REWE Bio;REWE Bio Hähnchenflügel ca. 480g;384;1 Stück ca. 480 g (1 kg = 7,99 €)
2026-06-08;1268116;REWE Bio;REWE Bio Hähnchengeschnetzeltes gewürzt 300g;567;1 Stück ca. 300 g (1 kg = 18,90 €)
2026-06-08;7314856;REWE Bio;REWE Bio Hähnchenlyoner 100g;199;100g (1 kg = 19,90 €)
2026-06-08;7331470;REWE Bio;REWE Bio Hähnchenlyoner Paprika 100g;199;100g (1 kg = 19,90 €)
2026-06-08;1267731;REWE Bio;REWE Bio Hähnchenschenkel;894;1 Stück ca. 600 g (1 kg = 14,90 €)
2026-06-08;1267753;REWE Bio;REWE Bio Hähnchenschenkel gewürzt ca. 590g;879;1 Stück ca. 590 g (1 kg = 14,90 €)
2026-06-08;9846183;REWE Bio;REWE Bio Hühnernudeltopf 800g;289;800g (1 kg = 3,61 €)
2026-06-08;9572641;REWE Bio;REWE Bio Ingwer Shot Passionsfrucht 150ml;129;150ml (1 l = 8,60 €)
2026-06-08;7721057;REWE Bio;REWE Bio Ingwer Shot mit Apfelsaft 150ml;129;150ml (1 l = 8,60 €)
2026-06-08;2849977;REWE Bio;REWE Bio Instant-Kaffee 100g;445;100g (1 kg = 44,50 €)
2026-06-08;7317421;REWE Bio;REWE Bio Jagdwurst 100g;199;100g (1 kg = 19,90 €)
2026-06-08;8714247;REWE Bio;REWE Bio Jasminreis weiß 500g;189;500g (1 kg = 3,78 €)
2026-06-08;9433630;REWE Bio;REWE Bio Joghurt Erdbeere 150g;59;150g (1 kg = 3,93 €)
2026-06-08;7173674;REWE Bio;REWE Bio Joghurt Mango 3,8% 150g;59;150g (1 kg = 3,93 €)
2026-06-08;8563309;REWE Bio;REWE Bio Joghurt Mango Vanille 500g;179;500g (1 kg = 3,58 €)
2026-06-08;7210751;REWE Bio;REWE Bio Joghurt Mild 0,1% 500g;99;500g (1 kg = 1,98 €)
2026-06-08;7208641;REWE Bio;REWE Bio Joghurt Mild 1,8% 150g;45;150g (1 kg = 3 €)
2026-06-08;8078338;REWE Bio;REWE Bio Joghurt Mild 1,8% 500g;139;500g (1 kg = 2,78 €)
2026-06-08;7175281;REWE Bio;REWE Bio Joghurt Mild Kokos 3,8% 150g;59;150g (1 kg = 3,93 €)
2026-06-08;194192;REWE Bio;REWE Bio Joghurt mild 150g;45;150g (1 kg = 3 €)
2026-06-08;8304439;REWE Bio;REWE Bio Joghurt mild 3,8% 500g;139;500g (1 kg = 2,78 €)
2026-06-08;1144899;REWE Bio;REWE Bio Joghurt mild 500g;115;500g (1 kg = 2,30 €)
2026-06-08;784611;REWE Bio;REWE Bio Joghurt mild Bircher Müsli 150g;59;150g (1 kg = 3,93 €)
2026-06-08;8159150;REWE Bio;REWE Bio Joghurt mild Himbeere 500g;179;500g (1 kg = 3,58 €)
2026-06-08;8896727;REWE Bio;REWE Bio Joghurt mild Pfirsich-Passionsfrucht 150g;59;150g (1 kg = 3,93 €)
2026-06-08;784792;REWE Bio;REWE Bio Joghurt mild Stracciatella 150g;59;150g (1 kg = 3,93 €)
2026-06-08;784616;REWE Bio;REWE Bio Joghurt mild Vanille 150g;59;150g (1 kg = 3,93 €)
2026-06-08;784808;REWE Bio;REWE Bio Joghurt mild Zitrone 150g;59;150g (1 kg = 3,93 €)
2026-06-08;194194;REWE Bio;REWE Bio Joghurt mild fettarm 500g;115;500g (1 kg = 2,30 €)
2026-06-08;8055541;REWE Bio;REWE Bio Joghurt mild mit Heidelbeere-Cassis 500g;179;500g (1 kg = 3,58 €)
2026-06-08;2277758;REWE Bio;REWE Bio Junge Erbsen 450g;189;450g (1 kg = 4,20 €)
2026-06-08;9044344;REWE Bio;REWE Bio Kabanos Salami 90g;239;90g (1 kg = 26,56 €)
2026-06-08;1255627;REWE Bio;REWE Bio Kaffeesahne 10% Fett 165g;119;165g (1 kg = 7,21 €)
2026-06-08;7283403;REWE Bio;REWE Bio Kaisergemüse 450g;189;450g (1 kg = 4,20 €)
2026-06-08;9539813;REWE Bio;REWE Bio Kakao Ringe 300g;249;300g (1 kg = 8,30 €)
2026-06-08;9850159;REWE Bio;REWE Bio Kalamata Oliven ohne Stein 350g;299;180g (1 kg = 16,61 €)
2026-06-08;8109025;REWE Bio;REWE Bio Kamillen Tee 30g;99;30g (1 kg = 33 €)
2026-06-08;9938793;REWE Bio;REWE Bio Kapern Surfines 60g;199;60g (1 kg = 33,17 €)
2026-06-08;7186203;REWE Bio;REWE Bio Karottensaft 0,5l;95;0,50l (1 l = 1,90 €)
2026-06-08;8602114;REWE Bio;REWE Bio Karottensalat 190g;109;190g (1 kg = 5,74 €)
2026-06-08;8393848;REWE Bio;REWE Bio Kartoffelpuffer 600g, 10 Stück;399;600g (1 kg = 6,65 €)
2026-06-08;7972072;REWE Bio;REWE Bio Kartoffelpüree vegan 2x80g;199;2x80g (1 kg = 12,44 €)
2026-06-08;9502775;REWE Bio;REWE Bio Kasseler 100g;349;100g (1 kg = 34,90 €)
2026-06-08;7672023;REWE Bio;REWE Bio Kefir Drink Pfirsich-Mango-Maracuja 500g;119;500g (1 kg = 2,38 €)
2026-06-08;8948382;REWE Bio;REWE Bio Kefir Natur 500g;119;480g (1 kg = 2,48 €)
2026-06-08;8946651;REWE Bio;REWE Bio Kefir Zitrone 500g;119;500g (1 kg = 2,38 €)
2026-06-08;9883539;REWE Bio;REWE Bio Kesselchips Sauerrahm Kräuter Style 125g;199;125g (1 kg = 15,92 €)
2026-06-08;9606223;REWE Bio;REWE Bio Ketchup 500ml;229;500ml (1 l = 4,58 €)
2026-06-08;7055914;REWE Bio;REWE Bio Kichererbsen 215g;85;215g (1 kg = 3,95 €)
2026-06-08;9067761;REWE Bio;REWE Bio Kichererbsen 500g;179;500g (1 kg = 3,58 €)
2026-06-08;3235642;REWE Bio;REWE Bio Kichererbsen-Kokos-Eintopf 400ml;229;400ml (1 l = 5,73 €)
2026-06-08;7667229;REWE Bio;REWE Bio Kichererbsenchips Meersalz 75g;179;75g (1 kg = 23,87 €)
2026-06-08;8979131;REWE Bio;REWE Bio Kidney-Bohnen 255g;119;255g (1 kg = 4,67 €)
2026-06-08;9897280;REWE Bio;REWE Bio Kinder Pasta aus Hartweizengrieß 500g;99;500g (1 kg = 1,98 €)
2026-06-08;9949578;REWE Bio;REWE Bio Kirschtomaten ganz 400g;99;240g (1 kg = 4,13 €)
2026-06-08;8376955;REWE Bio;REWE Bio Knollensellerie ca. 1kg;299;1 Stück ca. 1000 g (1 kg = 2,99 €)
2026-06-08;8969847;REWE Bio;REWE Bio Kochschinken 100g;289;100g (1 kg = 28,90 €)
2026-06-08;9106275;REWE Bio;REWE Bio Kokosmilch 200ml;119;200ml (1 l = 5,95 €)
2026-06-08;3274843;REWE Bio;REWE Bio Kokosmilch 400ml;159;400ml (1 l = 3,98 €)
2026-06-08;9097569;REWE Bio;REWE Bio Kokosmilch fettreduziert 400ml;159;400ml (1 l = 3,98 €)
2026-06-08;7570089;REWE Bio;REWE Bio Kokosmilch gelbes Curry 400g;199;400g (1 kg = 4,98 €)
2026-06-08;9105591;REWE Bio;REWE Bio Kokosmilch mit rotem Curry 400g;199;400g (1 kg = 4,98 €)
2026-06-08;9939316;REWE Bio;REWE Bio Kokoswasser 1l;299;1l
2026-06-08;8167380;REWE Bio;REWE Bio Kokosöl 620ml;545;620ml (1 l = 8,79 €)
2026-06-08;8978058;REWE Bio;REWE Bio Konfitüre Aprikose 330g;169;330g (1 kg = 5,12 €)
2026-06-08;8884075;REWE Bio;REWE Bio Kritharaki Nudeln 500g;169;500g (1 kg = 3,38 €)
2026-06-08;9983676;REWE Bio;REWE Bio Kräuter italienischer Art 20g;199;20g (1 kg = 99,50 €)
2026-06-08;7643892;REWE Bio;REWE Bio Kräuterquark 40% 200g;115;200g (1 kg = 5,75 €)
2026-06-08;7783486;REWE Bio;REWE Bio Kultur Heidelbeeren 300g;369;300g (1 kg = 12,30 €)
2026-06-08;8877187;REWE Bio;REWE Bio Kurkuma Shot mit Orangensaft 150ml;129;150ml (1 l = 8,60 €)
2026-06-08;8819370;REWE Bio;REWE Bio Kurkuma gemahlen 45g;299;45g (1 kg = 66,44 €)
2026-06-08;7306235;REWE Bio;REWE Bio Käutertee Österreichische Melisse 27g;179;27g (1 kg = 66,30 €)
2026-06-08;1906432;REWE Bio;REWE Bio Körniger Frischkäse 200g;149;200g (1 kg = 7,45 €)
2026-06-08;198343;REWE Bio;REWE Bio Kürbiskern-Brötchen 300g;289;300g (1 kg = 9,63 €)
2026-06-08;8820911;REWE Bio;REWE Bio Kürbiskerne 200g;229;200g (1 kg = 11,45 €)
2026-06-08;7342114;REWE Bio;REWE Bio Lachs-Filetportion Natur 200g;649;200g (1 kg = 32,45 €)
2026-06-08;9508061;REWE Bio;REWE Bio Lachsschinken 80g;319;80g (1 kg = 39,88 €)
2026-06-08;8066943;REWE Bio;REWE Bio Laugen Cracker 100g;139;100g (1 kg = 13,90 €)
2026-06-08;9090204;REWE Bio;REWE Bio Leberwurst fein 125g;199;125g (1 kg = 15,92 €)
2026-06-08;8178294;REWE Bio;REWE Bio Leberwurst mit Kalbfleisch, fein 125g;219;125g (1 kg = 17,52 €)
2026-06-08;7595609;REWE Bio;REWE Bio Leinsamen geschrotet 400g;199;400g (1 kg = 4,98 €)
2026-06-08;1919708;REWE Bio;REWE Bio Leinöl nativ 250ml;299;250ml (1 l = 11,96 €)
